{
  "site": "알바몬",
  "keyword": "반도체",
  "collected_at": "2025-11-20T19:44:23.354801",
  "jobs": [
    {
      "url": "https://www.albamon.com/jobs/detail/113191817",
      "title": "[대기업/반도체] 업계최고복지/단순기계운영/기숙사,셔틀운행/안정적인일자리~12/05(금)",
      "company": "#빠른지원 #010-5858-8334 #조기마감중",
      "location": "경기 안성시 가천중앙1길 1 (외가천리) 안성 산업단지 內",
      "salary": "3,610,195원",
      "conditions": "",
      "detail": "2025-11-20 19:28:57 [대기업/반도체] 업계최고복지/단순기계운영/기숙사,셔틀운행/안정적인일자리~12/05(금) #빠른지원 #010-5858-8334 #조기마감중 고용보험 산재보험 21년8월부터이용중 기업인증 근로계약서약속 성희롱예방교육수료 채용371회 피드백확률높음 근무조건 상세요강 기업정보 근무조건 급여 월급 3,610,195원 기본급 232만원 + 연장수당 + 심야수당 포함 기준 2025년 최저시급 10,030원 급여계산기 근무기간 1년이상 협의가능 근무요일 주5일 근무시간 09:00~21:00 (휴게시간 120분) 업직종 제조·가공·조립, 반도체·전자부품생산, 생산·건설·노무 기타 초보가능 고용형태 계약직, 정규직 복리후생 중식 제공, 주차 가능, 국민연금, 산재보험, 건강보험, 고용보험, 연차, 월차, 정기휴가, 장기근속자 포상, 퇴직금, 연장근로수당, 장기근속수당, 연월차수당, 야간근로수당, 휴일근로수당, 기숙사 운영, 각종 경조금, 석식 제공, 조식 제공, 근무복 지급, 통근버스 운행, 인센티브제 모집조건 모집마감 2025-12-05 마감 15일전 모집인원 00명 (인원미정) 친구와 함께 근무 가능 학력 학력무관 우대사항 차량소지, 운전 가능, 유사업무 경험 우대, 인근 거주 우대 이런 스킬 이 있으면 좋아요! 육안 검사 전동 조립 설비 조작 품질 검사 자재 관리 근무지역 경기 안성시 가천중앙1길 1 (외가천리) 안성 산업단지 內 복사 50m © NAVER Corp. 지도초기화 크게보기 길찾기 지도는 근무지 위치를 나타내며 회사 소재지와 일치하지 않을 수 있습니다. 상세요강 지원방법 온라인 지원 간편문자 지원 전화 지원 알바몬 팁 알바몬에서 보고 전화드렸습니다. 라고 한 후, 공고제목과 근무지역을 말씀하시면 빠른 문의가 가능합니다. 지원 전 주의사항 채권추심 보조 고액알바 및 체크카드, 계좌 비밀번호 요구는 취업을 빙자한 보이스피싱 사기 범죄일 수 있습니다. 보이스피싱 범죄에 가담하면 사기방조죄로 처벌받을 수 있습니다. 지원하기 전 꼭 확인하세요! 체불 사업주 명단 공개 지원자 통계 성별 및 연령 남성지원자 65% 여성지원자 35% 10대 6% 20대초반 12% 20대후반 29% 30대 18% 40대 35% 50대~ 학력 및 경력 중학교0% 대학교(4년)12% 고등학교82% 대학원6% 대학교(2,3년)0% 18% 경력없음 1년미만 12% 1 ~ 3년 24% 3 ~ 5년 18% 5 ~ 10년 29% 10년 ~ 지원자 성향 #무단 결근 절대 안 해요 #성실해요 #예의 발라요 기업정보 상세보기 ㈜비전솔루션 관심기업 110 대표 권오필 사업내용 아웃소싱 및 도급 서비스 회사주소 경기 화성시 동탄대로2길 131 (장지동) 대신빌딩 301호 안심할 수 있는 기업이에요 고용보험,산재보험 가입 완료 2021년 8월부터 알바몬 이용 중 알바몬 기업인증 완료(25.10.21) 알바몬 근로계약서 작성 약속 성희롱 예방교육수료 구인이 활발한 기업이에요 최근 1년간 채용 371회 진행 이력서 피드백 확률 높음! 본 정보는 ㈜비전솔루션에서 제공한 자료를 바탕으로 알바몬이 편집 및 그 표현방법을 수정하여 완성한 것입니다. 본 정보는 알바몬의 동의없이 무단전재 또는 재배포, 재가공할 수 없으며,게재된 채용기업과 채용담당자의 정보는 구직활동 이외의 용도로 사용할 수 없습니다. 알바몬은 ㈜비전솔루션에서 게재한 자료에 대한 오류와 사용자가 이를 신뢰하여 취한 조치에 대해 책임을 지지 않습니다.< 저작권자 ⓒ JOBKOREA, INC. 무단전제-재배포 금지 > 돌아가기 부적합·마감신고 top 버튼 TOP D-15 지원하기 sidebar menu",
      "recruit_summary": "",
      "posted_date": "2025-11-20"
    },
    {
      "url": "https://www.albamon.com/jobs/detail/112830626",
      "title": "[주간] 맞춤 PC 제작회사 조립 담당자 모집 (단순 PC 조립)상시모집",
      "company": "단순업무#잔업발생#정규직전환가능#㈜비에스파트너",
      "location": "경기 화성시 동탄첨단산업1로 63-5 (영천동) .",
      "salary": "10,030원",
      "conditions": "",
      "detail": "2025-11-20 19:28:14 [주간] 맞춤 PC 제작회사 조립 담당자 모집 (단순 PC 조립)상시모집 단순업무#잔업발생#정규직전환가능#㈜비에스파트너 4대보험 설립13년차 12년10월부터이용중 기업인증 채용114회 피드백확률높음 근무조건 상세요강 기업정보 근무조건 급여 시급 10,030원 2025년 최저시급 10,030원 급여계산기 근무기간 3개월~6개월 근무요일 월~금 근무시간 09:30~18:00 업직종 제조·가공·조립, 반도체·전자부품생산, PC·디지털기기 설치·관리 고용형태 정규직, 파견직 모집조건 모집마감 상시모집 모집인원 00명 (인원미정) 학력 고등학교 졸업 이상 우대사항 차량소지 근무지역 경기 화성시 동탄첨단산업1로 63-5 (영천동) . 복사 50m © NAVER Corp. 지도초기화 크게보기 길찾기 지도는 근무지 위치를 나타내며 회사 소재지와 일치하지 않을 수 있습니다. 상세요강 지원방법 온라인 지원 간편문자 지원 전화 지원 알바몬 팁 알바몬에서 보고 전화드렸습니다. 라고 한 후, 공고제목과 근무지역을 말씀하시면 빠른 문의가 가능합니다. 지원 전 주의사항 채권추심 보조 고액알바 및 체크카드, 계좌 비밀번호 요구는 취업을 빙자한 보이스피싱 사기 범죄일 수 있습니다. 보이스피싱 범죄에 가담하면 사기방조죄로 처벌받을 수 있습니다. 지원하기 전 꼭 확인하세요! 체불 사업주 명단 공개 지원자 통계 성별 및 연령 남성지원자 64% 여성지원자 36% 10대 14% 20대초반 18% 20대후반 27% 30대 23% 40대 18% 50대~ 학력 및 경력 중학교0% 대학교(4년)36% 고등학교32% 대학원5% 대학교(2,3년)27% 18% 경력없음 1년미만 27% 1 ~ 3년 14% 3 ~ 5년 18% 5 ~ 10년 23% 10년 ~ 기업정보 상세보기 ㈜비에스파트너 관심기업 358 대표 박병성 사업내용 인력아웃소싱, 헤드헌팅, 기타도급, 유통 외 회사주소 경기 화성시 동탄반석로 160 (반송동, 동탄 지웰 에스테이트) 210호 홈페이지 http://www.bspartner.co.kr 안심할 수 있는 기업이에요 4대 사회보험 가입 완료 2012년 10월부터 알바몬 이용 중 설립 13년! 안정적 기업 알바몬 기업인증 완료(23.03.03) 구인이 활발한 기업이에요 최근 1년간 채용 114회 진행 이력서 피드백 확률 높음! 본 정보는 ㈜비에스파트너에서 제공한 자료를 바탕으로 알바몬이 편집 및 그 표현방법을 수정하여 완성한 것입니다. 본 정보는 알바몬의 동의없이 무단전재 또는 재배포, 재가공할 수 없으며,게재된 채용기업과 채용담당자의 정보는 구직활동 이외의 용도로 사용할 수 없습니다. 알바몬은 ㈜비에스파트너에서 게재한 자료에 대한 오류와 사용자가 이를 신뢰하여 취한 조치에 대해 책임을 지지 않습니다.< 저작권자 ⓒ JOBKOREA, INC. 무단전제-재배포 금지 > 돌아가기 부적합·마감신고 top 버튼 TOP 지원하기 sidebar menu",
      "recruit_summary": "",
      "posted_date": "2025-11-20"
    },
    {
      "url": "https://www.albamon.com/jobs/detail/113316712",
      "title": "안산 HPCB cnc 드릴 , 설비, 출하 사원모집 교대근무 교통비지급상시모집",
      "company": "#반월공단#HPCB#CNC드릴#설비OP#기숙사",
      "location": "경기 안산시 단원구 중앙대로 421 (신길동, 모리아오피스텔) 306호",
      "salary": "3,500,000원",
      "conditions": "",
      "detail": "2025-11-20 19:27:15 안산 HPCB cnc 드릴 , 설비, 출하 사원모집 교대근무 교통비지급상시모집 #반월공단#HPCB#CNC드릴#설비OP#기숙사 4대보험 설립8년차 17년1월부터이용중 기업인증 근로계약서약속 성희롱예방교육수료 피드백확률높음 빠른연락가능 적극채용 근무조건 상세요강 기업정보 근무조건 급여 월급 3,500,000원 협의가능 주급가능 ※ 잔특근 여부에 따라 급여는 변동 될 수 있습니다 2025년 최저시급 10,030원 급여계산기 근무기간 1년이상 협의가능 근무요일 요일협의 (3조 2교대) 근무시간 08:00~20:00 (휴게시간 90분) 업직종 반도체·전자부품생산, 기계조작·오퍼레이터, 생산·건설·노무 기타 초보가능 고용형태 정규직, 파견직 복리후생 산재보험, 고용보험, 건강보험, 국민연금, 정기휴가, 정기보너스, 퇴직금, 명절 귀향비 지급, 중식 제공, 석식 제공, 근무복 지급, 통근버스 운행, 장기근속수당, 연월차수당, 야간근로수당, 조식 제공, 연장근로수당, 연차, 월차, 휴일근로수당, 각종 경조금, 경조휴가제, 기숙사 운영, 장기근속자 포상, 퇴직연금 모집조건 모집마감 상시모집 모집인원 00명 (인원미정) 친구와 함께 근무 가능 학력 학력무관 우대사항 유사업무 경험 우대 근무지역 경기 안산시 단원구 중앙대로 421 (신길동, 모리아오피스텔) 306호 복사 50m © NAVER Corp. 지도초기화 크게보기 길찾기 인근지하철 4호선 안산 도보 4분 신길온천 도보 30분 초지 도보 30분 지도는 근무지 위치를 나타내며 회사 소재지와 일치하지 않을 수 있습니다. 상세요강 지원방법 온라인 지원 간편문자 지원 전화 지원 바로 방문 알바몬 팁 알바몬에서 보고 전화드렸습니다. 라고 한 후, 공고제목과 근무지역을 말씀하시면 빠른 문의가 가능합니다. 지원 전 주의사항 채권추심 보조 고액알바 및 체크카드, 계좌 비밀번호 요구는 취업을 빙자한 보이스피싱 사기 범죄일 수 있습니다. 보이스피싱 범죄에 가담하면 사기방조죄로 처벌받을 수 있습니다. 지원하기 전 꼭 확인하세요! 체불 사업주 명단 공개 기업정보 상세보기 에스엠케이 관심기업 251 대표 송명광 사업내용 근로자파견/위생관리용역업/시설관리 회사주소 경기 안산시 단원구 중앙대로 421 (신길동, 모리아오피스텔) 306호 홈페이지 http:// 안심할 수 있는 기업이에요 4대 사회보험 가입 완료 2017년 1월부터 알바몬 이용 중 설립 8년! 안정적 기업 알바몬 기업인증 완료(23.03.03) 알바몬 근로계약서 작성 약속 성희롱 예방교육수료 구인이 활발한 기업이에요 이력서 피드백 확률 높음! 빠른 연락 가능! 채용 진행 알림 ON 기업 인재서비스 이용 중! 채용에 적극적인 기업 본 정보는 에스엠케이에서 제공한 자료를 바탕으로 알바몬이 편집 및 그 표현방법을 수정하여 완성한 것입니다. 본 정보는 알바몬의 동의없이 무단전재 또는 재배포, 재가공할 수 없으며,게재된 채용기업과 채용담당자의 정보는 구직활동 이외의 용도로 사용할 수 없습니다. 알바몬은 에스엠케이에서 게재한 자료에 대한 오류와 사용자가 이를 신뢰하여 취한 조치에 대해 책임을 지지 않습니다.< 저작권자 ⓒ JOBKOREA, INC. 무단전제-재배포 금지 > 돌아가기 부적합·마감신고 top 버튼 TOP 지원하기 sidebar menu",
      "recruit_summary": "",
      "posted_date": "2025-11-20"
    }
  ]
}